{
  "id": "m-asking-before-hug",
  "category": "respect-and-consent",
  "audience": "kids",
  "myth": "It's rude to say no to a hug.",
  "truth": "It's okay to say no — and kind to ask first.",
  "explanation": "Your body is yours. A wave or a high-five is always a perfectly good choice.",
  "tags": ["consent", "respect", "kindness"],
  "placeholder": true
}
