{
  "id": "m-sports-no-gender",
  "category": "gender-equality",
  "audience": "kids",
  "myth": "Boys are better at sports than girls.",
  "truth": "Skill comes from practice, not from gender.",
  "explanation": "Give anyone good coaching and time on the field and they'll improve - that's how sport works for everybody.",
  "tags": ["sports", "play", "gender"],
  "placeholder": true
}
