{
  "id": "m-scared-is-weak",
  "category": "emotions",
  "audience": "kids",
  "myth": "Being scared means you're weak.",
  "truth": "Everyone feels scared sometimes - that's human, not weak.",
  "explanation": "Naming a big feeling and asking for help is actually one of the bravest things you can do.",
  "tags": ["emotions", "fear", "courage"],
  "placeholder": true
}
