{
  "id": "m-teasing-not-joke",
  "category": "respect-and-consent",
  "audience": "kids",
  "myth": "It's just teasing, so it's fine.",
  "truth": "If it hurts someone, it isn't just a joke.",
  "explanation": "A good test: is everyone laughing, including the person it's about? If not, it's worth stopping and checking in.",
  "tags": ["respect", "kindness", "bullying"],
  "placeholder": true
}
