{
  "id": "m-all-feelings-ok",
  "category": "emotions",
  "audience": "kids",
  "myth": "Showing you're upset is bad manners.",
  "truth": "All feelings are okay - it's what we do with them that counts.",
  "explanation": "Hiding feelings doesn't make them go away. Naming them is the first step to handling them kindly.",
  "tags": ["emotions", "expression"],
  "placeholder": true
}
